<?xml version="1.0" encoding="UTF-8"?>
<xs:schema xmlns:xs="http://www.w3.org/2001/XMLSchema" elementFormDefault="qualified">
  <xs:element name="school">
    <xs:complexType>
      <xs:sequence>
        <xs:element ref="users"/>
        <xs:element ref="applications"/>
      </xs:sequence>
    </xs:complexType>
  </xs:element>
  <xs:element name="users">
    <xs:complexType>
      <xs:sequence>
        <xs:element ref="user" maxOccurs="unbounded"/>
      </xs:sequence>
    </xs:complexType>
  </xs:element>
  <xs:element name="user">
    <xs:complexType>
      <xs:attribute name="password" type="xs:string" use="required"/>
      <xs:attribute name="role" type="xs:string" use="required"/>
      <xs:attribute name="username" type="xs:string" use="required"/>
    </xs:complexType>
  </xs:element>
  <xs:element name="applications">
    <xs:complexType>
      <xs:sequence>
        <xs:element ref="application" maxOccurs="unbounded"/>
      </xs:sequence>
    </xs:complexType>
  </xs:element>
  <xs:element name="application">
    <xs:complexType>
      <xs:sequence>
        <xs:element ref="details"/>
      </xs:sequence>
      <xs:attribute name="status" type="xs:string" use="required"/>
      <xs:attribute name="student" type="xs:string" use="required"/>
    </xs:complexType>
  </xs:element>
  <xs:element name="details">
    <xs:complexType>
      <xs:sequence>
        <xs:element ref="fullname"/>
        <xs:element name="birthdate" type="xs:string"/>
        <xs:element name="tel" type="xs:string"/>
        <xs:element name="email" type="xs:string"/>
        <xs:element name="cin" type="xs:string"/>
        <xs:element name="cne" type="xs:string"/>
        <xs:element name="apoge" type="xs:string"/>
      </xs:sequence>
    </xs:complexType>
  </xs:element>
  <xs:element name="fullname">
    <xs:complexType>
      <xs:sequence>
        <xs:element name="fname" type="xs:string"/>
        <xs:element name="lname" type="xs:string"/>
      </xs:sequence>
    </xs:complexType>
  </xs:element>
</xs:schema>
